{
  "schema_version": "1.0",
  "catalog_version": "2026.08.04.1",
  "catalogVersion": "2026.08.04.1",
  "checked_at": "2026-08-04",
  "checkedAt": "2026-08-04",
  "effective_at": "2026-08-04",
  "supersedes": null,
  "update_policy": {
    "versioned": true,
    "immutable_versions": true,
    "same_query_hash_reuse": true,
    "unknown_is_never_zero": true
  },
  "fact_levels": [
    {
      "level": "SYSTEM_FACT",
      "definition": "A versioned, hash-bound fact emitted directly by the local production, publishing, or data-center system.",
      "numeric_metric_allowed": true,
      "requirements": ["Bind the local source version and SHA-256.", "Do not treat a local Stage 6 package state as a Publication Receipt."]
    },
    {
      "level": "PUBLIC_API_FACT",
      "definition": "A value present in an authorized import, recorded response, or safe read of a publicly visible YouTube Data API field.",
      "numeric_metric_allowed": true,
      "requirements": ["Bind collection time and raw response hash.", "Never relabel public counts as CTR, retention, traffic, device, demographic, subscriber, or Studio facts."]
    },
    {
      "level": "OWNER_ANALYTICS_FACT",
      "definition": "A value returned by YouTube Analytics or Reporting under separate channel-owner read authorization.",
      "numeric_metric_allowed": true,
      "requirements": ["Bind authorized channel, query or report identity, data cutoff, and raw hash.", "Keep upload authorization separate from Analytics authorization."]
    },
    {
      "level": "SAMPLE_OBSERVATION",
      "definition": "A limited observation from an explicitly bounded content or comment sample, not a channel-wide measured fact.",
      "numeric_metric_allowed": false,
      "requirements": ["Identify the sampled items and sample size.", "Do not generalize beyond the observed sample."]
    },
    {
      "level": "INFERENCE",
      "definition": "A falsifiable explanation derived from one or more bound facts but not established as causal truth.",
      "numeric_metric_allowed": false,
      "requirements": ["Bind supporting facts.", "State alternative explanations, confidence, and a verification action."]
    },
    {
      "level": "UNKNOWN",
      "definition": "The value is unavailable because the interface, permission, processing, threshold, sample, or completeness requirement is insufficient.",
      "numeric_metric_allowed": false,
      "requirements": ["Record the reason for unknown status.", "Never replace unknown, missing, delayed, or threshold-protected data with zero."]
    }
  ],
  "authorization_policy": {
    "upload_authorization_independent": true,
    "analytics": {
      "state": "AUTH_REQUIRED",
      "available": false,
      "minimum_readonly_scopes": ["https://www.googleapis.com/auth/yt-analytics.readonly"]
    },
    "monetary": {
      "state": "DISABLED",
      "requested": false,
      "enabled": false,
      "available": false,
      "scope": "https://www.googleapis.com/auth/yt-analytics-monetary.readonly"
    },
    "token_boundary": "Codex receives normalized data only and must not read or persist tokens, secrets, or OAuth client credentials.",
    "oauth_execution": "NOT_STARTED"
  },
  "source_capabilities": [
    {
      "source_id": "youtube.data-api.public",
      "surface": "YOUTUBE_DATA_API",
      "default_state": "IMPORT_ONLY",
      "available": true,
      "fact_level": "PUBLIC_API_FACT",
      "required_permissions": ["AUTHORIZED_PUBLIC_RESPONSE_OR_SAFE_READ"],
      "raw_immutability": "APPEND_ONLY",
      "notes": "Accepts authorized imports or a safe public-read adapter; this is not YouTube Studio or owner Analytics data. Synthetic fixtures remain synthetic facts in an isolated namespace."
    },
    {
      "source_id": "youtube.analytics.query",
      "surface": "YOUTUBE_ANALYTICS_API",
      "default_state": "AUTH_REQUIRED",
      "available": false,
      "fact_level": "OWNER_ANALYTICS_FACT",
      "required_permissions": ["https://www.googleapis.com/auth/yt-analytics.readonly"],
      "raw_immutability": "APPEND_ONLY",
      "notes": "Owner query capability is declared but unavailable until the user separately authorizes Analytics. No OAuth flow is started by this catalog."
    },
    {
      "source_id": "youtube.reporting.bulk",
      "surface": "YOUTUBE_REPORTING_API",
      "default_state": "AUTH_REQUIRED",
      "available": false,
      "fact_level": "OWNER_ANALYTICS_FACT",
      "required_permissions": ["https://www.googleapis.com/auth/yt-analytics.readonly"],
      "raw_immutability": "APPEND_ONLY",
      "notes": "Owner bulk-report capability is declared but unavailable until separately authorized; report IDs, createTime, coverage, and raw hashes must be retained for deduplication and revisions."
    },
    {
      "source_id": "local.system",
      "surface": "LOCAL_SYSTEM",
      "default_state": "AVAILABLE",
      "available": true,
      "fact_level": "SYSTEM_FACT",
      "required_permissions": ["LOCAL_CHANNEL_SCOPED_READ"],
      "raw_immutability": "APPEND_ONLY",
      "notes": "Reads only hash-bound upstream packages, production timeline maps, cost records, and statuses for the currently selected channel profile."
    }
  ],
  "dimensions": [
    {
      "dimension_id": "video",
      "definition": "The registered YouTube video identity; formal data-center use requires a real Publication Receipt and video ID.",
      "value_type": "STRING",
      "source_bindings": [
        {"source_id": "youtube.data-api.public", "official_field": "id", "official_source_ids": ["youtube.data.videos"]},
        {"source_id": "youtube.analytics.query", "official_field": "video", "official_source_ids": ["youtube.analytics.dimensions", "youtube.analytics.channel-reports"]},
        {"source_id": "youtube.reporting.bulk", "official_field": "video_id", "official_source_ids": ["youtube.reporting.channel-reports"]},
        {"source_id": "local.system", "official_field": "youtube_video_id", "official_source_ids": []}
      ],
      "privacy_sensitive": false,
      "threshold_behavior": "NOT_APPLICABLE"
    },
    {
      "dimension_id": "collected_at",
      "definition": "The offset-aware instant when a public response, owner response, bulk report, or local record was captured.",
      "value_type": "DATETIME",
      "source_bindings": [
        {"source_id": "local.system", "official_field": "collected_at", "official_source_ids": []}
      ],
      "privacy_sensitive": false,
      "threshold_behavior": "NOT_APPLICABLE"
    },
    {
      "dimension_id": "date",
      "definition": "The official YouTube reporting calendar date associated with a row, distinct from collection time.",
      "value_type": "DATE",
      "source_bindings": [
        {"source_id": "youtube.analytics.query", "official_field": "day", "official_source_ids": ["youtube.analytics.dimensions"]},
        {"source_id": "youtube.reporting.bulk", "official_field": "date", "official_source_ids": ["youtube.reporting.channel-reports", "youtube.reporting.reports"]}
      ],
      "privacy_sensitive": false,
      "threshold_behavior": "NOT_APPLICABLE"
    },
    {
      "dimension_id": "elapsed_video_time_ratio",
      "definition": "The ratio of elapsed video time used to locate an audience-retention measurement point.",
      "value_type": "NUMBER",
      "source_bindings": [
        {"source_id": "youtube.analytics.query", "official_field": "elapsedVideoTimeRatio", "official_source_ids": ["youtube.analytics.dimensions", "youtube.analytics.metrics"]}
      ],
      "privacy_sensitive": false,
      "threshold_behavior": "MAY_BE_WITHHELD"
    },
    {
      "dimension_id": "traffic_source",
      "definition": "The official category describing how viewers reached the video content.",
      "value_type": "STRING",
      "source_bindings": [
        {"source_id": "youtube.analytics.query", "official_field": "insightTrafficSourceType", "official_source_ids": ["youtube.analytics.dimensions", "youtube.analytics.channel-reports"]},
        {"source_id": "youtube.reporting.bulk", "official_field": "traffic_source_type", "official_source_ids": ["youtube.reporting.channel-reports"]}
      ],
      "privacy_sensitive": false,
      "threshold_behavior": "MAY_BE_WITHHELD"
    },
    {
      "dimension_id": "playback_location",
      "definition": "The official category for the page or application in which video playback occurred.",
      "value_type": "STRING",
      "source_bindings": [
        {"source_id": "youtube.analytics.query", "official_field": "insightPlaybackLocationType", "official_source_ids": ["youtube.analytics.dimensions", "youtube.analytics.channel-reports"]},
        {"source_id": "youtube.reporting.bulk", "official_field": "playback_location_type", "official_source_ids": ["youtube.reporting.channel-reports"]}
      ],
      "privacy_sensitive": false,
      "threshold_behavior": "MAY_BE_WITHHELD"
    },
    {
      "dimension_id": "country",
      "definition": "The country associated with the activity row, represented by the source's official country code field.",
      "value_type": "STRING",
      "source_bindings": [
        {"source_id": "youtube.analytics.query", "official_field": "country", "official_source_ids": ["youtube.analytics.dimensions", "youtube.analytics.channel-reports"]},
        {"source_id": "youtube.reporting.bulk", "official_field": "country_code", "official_source_ids": ["youtube.reporting.channel-reports"]}
      ],
      "privacy_sensitive": true,
      "threshold_behavior": "UNKNOWN_WHEN_WITHHELD"
    },
    {
      "dimension_id": "device_type",
      "definition": "The official category of device on which the viewing activity occurred.",
      "value_type": "STRING",
      "source_bindings": [
        {"source_id": "youtube.analytics.query", "official_field": "deviceType", "official_source_ids": ["youtube.analytics.dimensions", "youtube.analytics.channel-reports"]},